{
  "schemaVersion": "1.0.0",
  "jobId": "PB-20260825-0123456789",
  "sourcePackageHash": "9999999999999999999999999999999999999999999999999999999999999999",
  "createdAt": "2026-08-25T08:10:00Z",
  "producer": "Adversarial Synthetic",
  "findings": [
    {
      "findingId": "cccccccc-cccc-4ccc-8ccc-cccccccccccc",
      "entityRefs": [
        "⟦PB:PERSON:0000000000000000:00000000000000000000⟧"
      ],
      "category": "forgery",
      "summary": "Unknown token",
      "sourceDocumentIds": [
        "55555555-5555-4555-8555-555555555555"
      ]
    }
  ]
}
